{
  "$comment": "Runtime-only invariants include span time ordering, duplicate identifiers, and metric references.",
  "$schema": "https://json-schema.org/draft/2020-12/schema",
  "additionalProperties": false,
  "properties": {
    "created_at": {
      "format": "date-time",
      "pattern": "^(?:(?:\\d\\d[2468][048]|\\d\\d[13579][26]|\\d\\d0[48]|[02468][048]00|[13579][26]00)-02-29|\\d{4}-(?:(?:0[13578]|1[02])-(?:0[1-9]|[12]\\d|3[01])|(?:0[469]|11)-(?:0[1-9]|[12]\\d|30)|(?:02)-(?:0[1-9]|1\\d|2[0-8])))T(?:(?:[01]\\d|2[0-3]):[0-5]\\d(?::[0-5]\\d(?:\\.\\d+)?)?(?:Z|([+-](?:[01]\\d|2[0-3]):[0-5]\\d)))$",
      "type": "string"
    },
    "effective_command": {
      "additionalProperties": false,
      "properties": {
        "argv": {
          "items": {
            "type": "string"
          },
          "minItems": 1,
          "type": "array"
        },
        "command_path": {
          "prefixItems": [
            {
              "const": "eval",
              "type": "string"
            },
            {
              "const": "run",
              "type": "string"
            }
          ],
          "type": "array"
        },
        "request": {
          "anyOf": [
            {
              "additionalProperties": false,
              "properties": {
                "baseline_run_id": {
                  "format": "ulid",
                  "pattern": "^[0-9A-HJKMNP-TV-Za-hjkmnp-tv-z]{26}$",
                  "type": "string"
                },
                "case_ids": {
                  "items": {
                    "pattern": "^[a-z][a-z0-9]*(?:-[a-z0-9]+)*$",
                    "type": "string"
                  },
                  "minItems": 1,
                  "type": "array"
                },
                "command": {
                  "const": "eval.run",
                  "type": "string"
                },
                "concurrency": {
                  "exclusiveMinimum": 0,
                  "maximum": 9007199254740991,
                  "type": "integer"
                },
                "junit_path": {
                  "minLength": 1,
                  "type": "string"
                },
                "output": {
                  "const": "human",
                  "type": "string"
                },
                "schema": {
                  "const": "attest.command-request/v2",
                  "type": "string"
                },
                "tags": {
                  "items": {
                    "minLength": 1,
                    "type": "string"
                  },
                  "minItems": 1,
                  "type": "array"
                },
                "test_ids": {
                  "items": {
                    "pattern": "^[a-z][a-z0-9]*(?:-[a-z0-9]+)*$",
                    "type": "string"
                  },
                  "minItems": 1,
                  "type": "array"
                },
                "timeout_ms": {
                  "exclusiveMinimum": 0,
                  "maximum": 9007199254740991,
                  "type": "integer"
                },
                "watch": {
                  "type": "boolean"
                }
              },
              "required": [
                "schema",
                "command",
                "test_ids",
                "output"
              ],
              "type": "object"
            },
            {
              "additionalProperties": false,
              "properties": {
                "baseline_run_id": {
                  "format": "ulid",
                  "pattern": "^[0-9A-HJKMNP-TV-Za-hjkmnp-tv-z]{26}$",
                  "type": "string"
                },
                "case_ids": {
                  "items": {
                    "pattern": "^[a-z][a-z0-9]*(?:-[a-z0-9]+)*$",
                    "type": "string"
                  },
                  "minItems": 1,
                  "type": "array"
                },
                "command": {
                  "const": "eval.run",
                  "type": "string"
                },
                "concurrency": {
                  "exclusiveMinimum": 0,
                  "maximum": 9007199254740991,
                  "type": "integer"
                },
                "junit_path": {
                  "minLength": 1,
                  "type": "string"
                },
                "output": {
                  "enum": [
                    "json",
                    "jsonl"
                  ],
                  "type": "string"
                },
                "schema": {
                  "const": "attest.command-request/v2",
                  "type": "string"
                },
                "tags": {
                  "items": {
                    "minLength": 1,
                    "type": "string"
                  },
                  "minItems": 1,
                  "type": "array"
                },
                "test_ids": {
                  "items": {
                    "pattern": "^[a-z][a-z0-9]*(?:-[a-z0-9]+)*$",
                    "type": "string"
                  },
                  "minItems": 1,
                  "type": "array"
                },
                "timeout_ms": {
                  "exclusiveMinimum": 0,
                  "maximum": 9007199254740991,
                  "type": "integer"
                }
              },
              "required": [
                "schema",
                "command",
                "test_ids",
                "output"
              ],
              "type": "object"
            },
            {
              "additionalProperties": false,
              "properties": {
                "all": {
                  "const": true,
                  "type": "boolean"
                },
                "baseline_run_id": {
                  "format": "ulid",
                  "pattern": "^[0-9A-HJKMNP-TV-Za-hjkmnp-tv-z]{26}$",
                  "type": "string"
                },
                "case_ids": {
                  "items": {
                    "pattern": "^[a-z][a-z0-9]*(?:-[a-z0-9]+)*$",
                    "type": "string"
                  },
                  "minItems": 1,
                  "type": "array"
                },
                "command": {
                  "const": "eval.run",
                  "type": "string"
                },
                "concurrency": {
                  "exclusiveMinimum": 0,
                  "maximum": 9007199254740991,
                  "type": "integer"
                },
                "junit_path": {
                  "minLength": 1,
                  "type": "string"
                },
                "output": {
                  "const": "human",
                  "type": "string"
                },
                "schema": {
                  "const": "attest.command-request/v2",
                  "type": "string"
                },
                "tags": {
                  "items": {
                    "minLength": 1,
                    "type": "string"
                  },
                  "minItems": 1,
                  "type": "array"
                },
                "timeout_ms": {
                  "exclusiveMinimum": 0,
                  "maximum": 9007199254740991,
                  "type": "integer"
                },
                "watch": {
                  "type": "boolean"
                }
              },
              "required": [
                "schema",
                "command",
                "all",
                "output"
              ],
              "type": "object"
            },
            {
              "additionalProperties": false,
              "properties": {
                "all": {
                  "const": true,
                  "type": "boolean"
                },
                "baseline_run_id": {
                  "format": "ulid",
                  "pattern": "^[0-9A-HJKMNP-TV-Za-hjkmnp-tv-z]{26}$",
                  "type": "string"
                },
                "case_ids": {
                  "items": {
                    "pattern": "^[a-z][a-z0-9]*(?:-[a-z0-9]+)*$",
                    "type": "string"
                  },
                  "minItems": 1,
                  "type": "array"
                },
                "command": {
                  "const": "eval.run",
                  "type": "string"
                },
                "concurrency": {
                  "exclusiveMinimum": 0,
                  "maximum": 9007199254740991,
                  "type": "integer"
                },
                "junit_path": {
                  "minLength": 1,
                  "type": "string"
                },
                "output": {
                  "enum": [
                    "json",
                    "jsonl"
                  ],
                  "type": "string"
                },
                "schema": {
                  "const": "attest.command-request/v2",
                  "type": "string"
                },
                "tags": {
                  "items": {
                    "minLength": 1,
                    "type": "string"
                  },
                  "minItems": 1,
                  "type": "array"
                },
                "timeout_ms": {
                  "exclusiveMinimum": 0,
                  "maximum": 9007199254740991,
                  "type": "integer"
                }
              },
              "required": [
                "schema",
                "command",
                "all",
                "output"
              ],
              "type": "object"
            }
          ]
        },
        "resolved": {
          "additionalProperties": false,
          "properties": {
            "baseline_run_id": {
              "format": "ulid",
              "pattern": "^[0-9A-HJKMNP-TV-Za-hjkmnp-tv-z]{26}$",
              "type": "string"
            },
            "concurrency": {
              "exclusiveMinimum": 0,
              "maximum": 9007199254740991,
              "type": "integer"
            },
            "junit_path": {
              "minLength": 1,
              "type": "string"
            },
            "output": {
              "enum": [
                "human",
                "json",
                "jsonl"
              ],
              "type": "string"
            },
            "timeout_ms": {
              "exclusiveMinimum": 0,
              "maximum": 9007199254740991,
              "type": "integer"
            },
            "watch": {
              "type": "boolean"
            }
          },
          "required": [
            "concurrency",
            "timeout_ms",
            "output",
            "watch"
          ],
          "type": "object"
        }
      },
      "required": [
        "command_path",
        "argv",
        "request",
        "resolved"
      ],
      "type": "object"
    },
    "git": {
      "additionalProperties": false,
      "properties": {
        "branch": {
          "minLength": 1,
          "type": "string"
        },
        "commit": {
          "pattern": "^[a-f0-9]{7,64}$",
          "type": "string"
        },
        "dirty": {
          "type": "boolean"
        }
      },
      "required": [
        "commit",
        "dirty"
      ],
      "type": "object"
    },
    "run_id": {
      "format": "ulid",
      "pattern": "^[0-9A-HJKMNP-TV-Za-hjkmnp-tv-z]{26}$",
      "type": "string"
    },
    "schema": {
      "const": "attest.eval-run/v1",
      "type": "string"
    },
    "snapshot": {
      "additionalProperties": false,
      "properties": {
        "project_hash": {
          "pattern": "^[a-f0-9]{64}$",
          "type": "string"
        },
        "project_id": {
          "format": "ulid",
          "pattern": "^[0-9A-HJKMNP-TV-Za-hjkmnp-tv-z]{26}$",
          "type": "string"
        },
        "resource_hashes": {
          "additionalProperties": false,
          "properties": {
            "agents": {
              "items": {
                "additionalProperties": false,
                "properties": {
                  "content_hash": {
                    "pattern": "^[a-f0-9]{64}$",
                    "type": "string"
                  },
                  "id": {
                    "pattern": "^[a-z][a-z0-9]*(?:-[a-z0-9]+)*$",
                    "type": "string"
                  }
                },
                "required": [
                  "id",
                  "content_hash"
                ],
                "type": "object"
              },
              "type": "array"
            },
            "datasets": {
              "items": {
                "additionalProperties": false,
                "properties": {
                  "data_content_hash": {
                    "pattern": "^[a-f0-9]{64}$",
                    "type": "string"
                  },
                  "id": {
                    "pattern": "^[a-z][a-z0-9]*(?:-[a-z0-9]+)*$",
                    "type": "string"
                  },
                  "metadata_content_hash": {
                    "pattern": "^[a-f0-9]{64}$",
                    "type": "string"
                  }
                },
                "required": [
                  "id",
                  "data_content_hash",
                  "metadata_content_hash"
                ],
                "type": "object"
              },
              "type": "array"
            },
            "metrics": {
              "items": {
                "additionalProperties": false,
                "properties": {
                  "content_hash": {
                    "pattern": "^[a-f0-9]{64}$",
                    "type": "string"
                  },
                  "id": {
                    "pattern": "^[a-z][a-z0-9]*(?:-[a-z0-9]+)*$",
                    "type": "string"
                  }
                },
                "required": [
                  "id",
                  "content_hash"
                ],
                "type": "object"
              },
              "type": "array"
            },
            "tests": {
              "items": {
                "additionalProperties": false,
                "properties": {
                  "content_hash": {
                    "pattern": "^[a-f0-9]{64}$",
                    "type": "string"
                  },
                  "id": {
                    "pattern": "^[a-z][a-z0-9]*(?:-[a-z0-9]+)*$",
                    "type": "string"
                  }
                },
                "required": [
                  "id",
                  "content_hash"
                ],
                "type": "object"
              },
              "type": "array"
            }
          },
          "required": [
            "agents",
            "tests",
            "datasets",
            "metrics"
          ],
          "type": "object"
        },
        "selected_cases": {
          "items": {
            "additionalProperties": false,
            "properties": {
              "case_id": {
                "pattern": "^[a-z][a-z0-9]*(?:-[a-z0-9]+)*$",
                "type": "string"
              },
              "configured_index": {
                "maximum": 9007199254740991,
                "minimum": 0,
                "type": "integer"
              },
              "source": {
                "oneOf": [
                  {
                    "additionalProperties": false,
                    "properties": {
                      "kind": {
                        "const": "direct",
                        "type": "string"
                      }
                    },
                    "required": [
                      "kind"
                    ],
                    "type": "object"
                  },
                  {
                    "additionalProperties": false,
                    "properties": {
                      "dataset_id": {
                        "pattern": "^[a-z][a-z0-9]*(?:-[a-z0-9]+)*$",
                        "type": "string"
                      },
                      "kind": {
                        "const": "dataset",
                        "type": "string"
                      }
                    },
                    "required": [
                      "kind",
                      "dataset_id"
                    ],
                    "type": "object"
                  }
                ]
              },
              "test_id": {
                "pattern": "^[a-z][a-z0-9]*(?:-[a-z0-9]+)*$",
                "type": "string"
              }
            },
            "required": [
              "configured_index",
              "test_id",
              "case_id",
              "source"
            ],
            "type": "object"
          },
          "type": "array"
        },
        "selected_test_ids": {
          "items": {
            "pattern": "^[a-z][a-z0-9]*(?:-[a-z0-9]+)*$",
            "type": "string"
          },
          "minItems": 1,
          "type": "array"
        }
      },
      "required": [
        "project_id",
        "project_hash",
        "resource_hashes",
        "selected_test_ids",
        "selected_cases"
      ],
      "type": "object"
    },
    "snapshot_hash": {
      "pattern": "^[a-f0-9]{64}$",
      "type": "string"
    }
  },
  "required": [
    "schema",
    "run_id",
    "created_at",
    "snapshot_hash",
    "snapshot",
    "effective_command"
  ],
  "type": "object"
}
